{
  "ledger_transaction_id": "550e8400-e29b-41d4-a716-446655440000",
  "broker": "qmt",
  "account_id": "a",
  "trading_day": "2026-07-02",
  "trade_id": "t1",
  "order_id": "550e8400-e29b-41d4-a716-446655440001",
  "instrument_id": "600000.XSHG",
  "side": "BUY",
  "position_effect": "AUTO",
  "price": "10.01000000",
  "quantity": 100,
  "currency": "CNY",
  "entries": [
    {
      "account_code": "SEC",
      "direction": "DEBIT",
      "amount": "1001.00",
      "currency": "CNY"
    },
    {
      "account_code": "CASH",
      "direction": "CREDIT",
      "amount": "1001.00",
      "currency": "CNY"
    }
  ],
  "posted_at": "2026-07-02T02:00:00Z"
}
