{
  "ledger_transaction_id": "550e8400-e29b-41d4-a716-446655440000",
  "broker": "xxxxxxxxxxxxxxxxxxxxxxxxxxxxxxxxxxxxxxxxxxxxxxxxxxxxxxxxxxxxxxxx",
  "account_id": "xxxxxxxxxxxxxxxxxxxxxxxxxxxxxxxxxxxxxxxxxxxxxxxxxxxxxxxxxxxxxxxxxxxxxxxxxxxxxxxxxxxxxxxxxxxxxxxxxxxxxxxxxxxxxxxxxxxxxxxxxxxxxxxx",
  "trading_day": "2026-07-02",
  "trade_id": "xxxxxxxxxxxxxxxxxxxxxxxxxxxxxxxxxxxxxxxxxxxxxxxxxxxxxxxxxxxxxxxxxxxxxxxxxxxxxxxxxxxxxxxxxxxxxxxxxxxxxxxxxxxxxxxxxxxxxxxxxxxxxxxx",
  "order_id": "550e8400-e29b-41d4-a716-446655440001",
  "instrument_id": "xxxxxxxxxxxxxxxxxxxxxxxxxxxxxxxxxxxxxxxxxxxxxxxxxxxxxxxxxxxxxxxx",
  "side": "BUY",
  "position_effect": "AUTO",
  "price": "10.00000000",
  "quantity": 100,
  "currency": "CNY",
  "entries": [
    {
      "account_code": "xxxxxxxxxxxxxxxxxxxxxxxxxxxxxxxxxxxxxxxxxxxxxxxxxxxxxxxxxxxxxxxx",
      "direction": "DEBIT",
      "amount": "1001.00000000",
      "currency": "CNY"
    },
    {
      "account_code": "xxxxxxxxxxxxxxxxxxxxxxxxxxxxxxxxxxxxxxxxxxxxxxxxxxxxxxxxxxxxxxxx",
      "direction": "CREDIT",
      "amount": "1001.00000000",
      "currency": "CNY"
    }
  ],
  "posted_at": "2026-07-02T02:00:00Z",
  "commission": "0.00000000",
  "tax": "0.00000000"
}
